{
  "$schema": "https://json-schema.org/draft/2020-12/schema",
  "$id": "cadd-schema.json",
  "title": "CADD Score Record",
  "description": "JSON Schema for CADD (Combined Annotation Dependent Depletion) variant deleteriousness scores.",
  "type": "object",
  "properties": {
    "Chrom": {
      "type": "string",
      "description": "Chromosome identifier.",
      "enum": ["1", "2", "3", "4", "5", "6", "7", "8", "9", "10", "11", "12", "13", "14", "15", "16", "17", "18", "19", "20", "21", "22", "X", "Y", "MT"]
    },
    "Pos": {
      "type": "integer",
      "description": "1-based genomic position (GRCh38).",
      "examples": [69094, 942451]
    },
    "Ref": {
      "type": "string",
      "description": "Reference allele.",
      "pattern": "^[ACGT]+$",
      "examples": ["A", "C", "G", "T"]
    },
    "Alt": {
      "type": "string",
      "description": "Alternate allele.",
      "pattern": "^[ACGT]+$",
      "examples": ["G", "T", "A", "C"]
    },
    "RawScore": {
      "type": "number",
      "description": "CADD raw score (unbounded, higher = more deleterious).",
      "examples": [5.5, 2.1, -0.5, 8.2]
    },
    "PHRED": {
      "type": "number",
      "description": "CADD Phred-scaled score (1-99, higher = more deleterious). Score of 10 = top 10%, 20 = top 1%.",
      "minimum": 0,
      "examples": [25.3, 15.0, 0.5, 35.0]
    },
    "GeneName": {
      "type": "string",
      "description": "Gene symbol from annotation.",
      "examples": ["TP53", "BRCA1", "HBB"]
    },
    "GeneID": {
      "type": "string",
      "description": "Ensembl gene ID.",
      "pattern": "^ENSG[0-9]{11}$",
      "examples": ["ENSG00000141510"]
    },
    "FeatureID": {
      "type": "string",
      "description": "Ensembl transcript ID.",
      "pattern": "^ENST[0-9]{11}$",
      "examples": ["ENST00000269305"]
    },
    "Consequence": {
      "type": "string",
      "description": "Most severe VEP consequence.",
      "enum": [
        "transcript_ablation", "splice_acceptor_variant", "splice_donor_variant",
        "stop_gained", "frameshift_variant", "stop_lost", "start_lost",
        "transcript_amplification", "inframe_insertion", "inframe_deletion",
        "missense_variant", "protein_altering_variant", "splice_region_variant",
        "incomplete_terminal_codon_variant", "start_retained_variant", "stop_retained_variant",
        "synonymous_variant", "coding_sequence_variant", "mature_miRNA_variant",
        "5_prime_UTR_variant", "3_prime_UTR_variant", "non_coding_transcript_exon_variant",
        "intron_variant", "NMD_transcript_variant", "non_coding_transcript_variant",
        "upstream_gene_variant", "downstream_gene_variant", "TFBS_ablation",
        "TFBS_amplification", "TF_binding_site_variant", "regulatory_region_ablation",
        "regulatory_region_amplification", "feature_elongation", "regulatory_region_variant",
        "feature_truncation", "intergenic_variant"
      ]
    },
    "ConsScore": {
      "type": "integer",
      "description": "Consequence score (higher = more severe).",
      "minimum": 0,
      "maximum": 10,
      "examples": [8, 5, 2]
    },
    "ConsDetail": {
      "type": "string",
      "description": "Detailed consequence description.",
      "examples": ["missense_variant", "stop_gained&splice_region_variant"]
    },
    "Amino_Acids": {
      "type": "string",
      "description": "Reference and alternate amino acids (Ref/Alt).",
      "examples": ["R/Q", "V/E", "G/D"]
    },
    "Codons": {
      "type": "string",
      "description": "Reference and alternate codons (ref/alt).",
      "examples": ["cGa/cAa", "gTg/gAg"]
    },
    "cDNApos": {
      "type": "integer",
      "description": "Position in cDNA.",
      "examples": [743, 1234]
    },
    "CDSpos": {
      "type": "integer",
      "description": "Position in coding sequence.",
      "examples": [743, 1234]
    },
    "protPos": {
      "type": "integer",
      "description": "Position in protein.",
      "examples": [248, 412]
    },
    "Domain": {
      "type": "string",
      "description": "Protein domain if annotated.",
      "examples": ["P53_TAD", "BRCT"]
    },
    "Dst2Splice": {
      "type": "integer",
      "description": "Distance to nearest splice site.",
      "examples": [0, 5, 100, -50]
    },
    "Dst2SplType": {
      "type": "string",
      "description": "Type of nearest splice site.",
      "enum": ["ACCEPTOR", "DONOR"]
    },
    "GC": {
      "type": "number",
      "description": "GC content of surrounding region.",
      "minimum": 0,
      "maximum": 1,
      "examples": [0.45, 0.62]
    },
    "CpG": {
      "type": "number",
      "description": "CpG content of surrounding region.",
      "minimum": 0,
      "maximum": 1,
      "examples": [0.02, 0.08]
    },
    "minDistTSS": {
      "type": "integer",
      "description": "Minimum distance to transcription start site.",
      "examples": [500, 10000, 0]
    },
    "minDistTSE": {
      "type": "integer",
      "description": "Minimum distance to transcription end site.",
      "examples": [1000, 50000, 0]
    },
    "SIFTval": {
      "type": "number",
      "description": "SIFT score (0-1, lower = more damaging).",
      "minimum": 0,
      "maximum": 1
    },
    "SIFTcat": {
      "type": "string",
      "description": "SIFT category.",
      "enum": ["deleterious", "tolerated"]
    },
    "PolyPhenVal": {
      "type": "number",
      "description": "PolyPhen-2 score (0-1, higher = more damaging).",
      "minimum": 0,
      "maximum": 1
    },
    "PolyPhenCat": {
      "type": "string",
      "description": "PolyPhen-2 category.",
      "enum": ["probably_damaging", "possibly_damaging", "benign"]
    },
    "GerpRS": {
      "type": "number",
      "description": "GERP++ rejected substitution score.",
      "examples": [5.82, 2.1, -3.5]
    },
    "GerpN": {
      "type": "number",
      "description": "GERP++ neutral evolution score.",
      "examples": [5.5, 3.2]
    },
    "GerpS": {
      "type": "number",
      "description": "GERP++ S score.",
      "examples": [5.82, 2.1]
    },
    "bStatistic": {
      "type": "integer",
      "description": "Background selection statistic.",
      "examples": [800, 950]
    },
    "priPhCons": {
      "type": "number",
      "description": "Primate phastCons score.",
      "minimum": 0,
      "maximum": 1
    },
    "mamPhCons": {
      "type": "number",
      "description": "Mammalian phastCons score.",
      "minimum": 0,
      "maximum": 1
    },
    "verPhCons": {
      "type": "number",
      "description": "Vertebrate phastCons score.",
      "minimum": 0,
      "maximum": 1
    },
    "priPhyloP": {
      "type": "number",
      "description": "Primate phyloP score.",
      "examples": [0.5, 2.1]
    },
    "mamPhyloP": {
      "type": "number",
      "description": "Mammalian phyloP score.",
      "examples": [1.5, 4.2]
    },
    "verPhyloP": {
      "type": "number",
      "description": "Vertebrate phyloP score.",
      "examples": [2.5, 7.5]
    },
    "EncodeH3K27Ac": {
      "type": "number",
      "description": "ENCODE H3K27ac signal.",
      "minimum": 0
    },
    "EncodeH3K4Me1": {
      "type": "number",
      "description": "ENCODE H3K4me1 signal.",
      "minimum": 0
    },
    "EncodeH3K4Me3": {
      "type": "number",
      "description": "ENCODE H3K4me3 signal.",
      "minimum": 0
    },
    "EncodeTFBS": {
      "type": "number",
      "description": "ENCODE transcription factor binding site score.",
      "minimum": 0
    },
    "EncodeDNase": {
      "type": "number",
      "description": "ENCODE DNase hypersensitivity signal.",
      "minimum": 0
    }
  },
  "required": ["Chrom", "Pos", "Ref", "Alt", "RawScore", "PHRED"],
  "additionalProperties": true
}
